headline,grade
Trump makes play for deep-blue state Reagan last won in ‘84 landslide,4.4
"VP Harris gets heckled during Michigan rally, forced to pause remarks: ‘Now I am speaking…’",8.0
Michelle Obama's excuse for Harris' interview questions that critics are 'picking apart',9.2
"Former Vatican ambassador urges Catholics to back Trump, brands Harris ‘infernal monster’",10.3
Vulnerable Senate Democrat suffers blow as major union makes endorsement,10.7
Bill Maher calls for Harris to pull tried-and-true tactic to ‘earn cred’ with skeptics,5.2
Experts warn of hidden election threat with unexpected impact on everyday Americans,11.5
College football star flashes MAGA shirt after scoring touchdown on trick play,8.0
NBA coach takes game presser as a platform to slam presidential candidate,8.0
Swing state voters are asked to describe Harris in one word — and very clear pattern emerges,6.0
WATCH:Texas HS football game ends in an insane way,3.3
LISTEN NOW:Former President Trump on 'The Brian Kilmeade Show',6.8
Create a beautiful Thanksgiving table setting with these 9 finds,8.4
WATCH LIVE:‘Sunday Morning Futures with Maria Bartiromo’,7.2
City pays $1.5 million after years-long fight to take down cross,1.9
Vance flips opponent’s talking point on its head: ‘My message to Kamala Harris…’,7.2
Political analyst has clear-cut message for Dems in battleground state,9.6
Gov Ron DeSantis discusses 'massive shift' he sees in Florida's electorate,7.6
Political cartoons of the day,7.6
Battleground state autoworker’s prediction about the blue voting bloc swinging,9.6
The four 'dreaded' letters on airline boarding passes that travelers never want to see,8.8
PLAY NOW!Crosswords ♠ Word Search ♦ Crazy Crystals ♣ Stack & Match ♥ 5 Across!,2.5
Country music stars join forces at concert to raise staggering sum for hurricane victims,8.8
Costco puts shoppers on high alert with recall on popular breakfast food,6.8
'90s fitness icon now delivers food after losing multimillion-dollar empire,13.1
One of the most competitive states in high-stakes election begins early voting,9.2
Harris-Walz face uphill battle in separate showdown that's not the election,7.6
Pop culture guru makes prediction about Menendez brothers after release,9.6
Harris has yet to do formal press conference since emerging as Dem nominee,7.2
'Conclave' movie director says controversial scenes 'not a takedown of the church',8.0
"FOX Corporation launches donation drive for Hurricanes Helene, Milton relief efforts",13.5
Woman puts her own spin on viral recipe using ingredients you likely already have,8.8
"Test yourself on hit TV shows, sports stars and Halloween",2.5
‘Home Improvement’ actor in hot water for second time this year,6.4
Deputies arrest illegal immigrants allegedly caught looting from hurricane victims,13.1
Bill Murray's former home in swanky star-studded enclave hits the market,6.4
"Michigan, Michigan State players brawl after game: 'Lil’ bro stay doing lil’ bro things'",6.4
Zach Bryan backlash over breakup is latest controversy after arrest,8.4
Trump campaign rips Harris for misleading supporters with Beyoncé: ‘Lied to build crowd’,9.5
Prince William publicly mentions Prince Harry for first time in recent memory,6.8
"After strikes, Israel warns Iran what will happen if it escalates conflict again",7.2
Child-abusing mommy blogger's daughter warns about posting kids' pictures online,9.6
Lizzo makes a point with Halloween costume after denying taking weight loss drug,7.2
"Mahomes is already ‘No. 2 in the GOAT conversation,’ former NFL star says",4.6
Livvy Dunne reflects on watching Simone Biles in person at Olympics,5.2
Fox News brings Democracy 2024 to the sky with CGI!,2.5
"ANTISEMITISM EXPOSED:Truck ramming attack near Israeli army base leaves 1 dead, dozens injured",7.2
FOX Nation Patriot Awards moves to New York with tickets now on sale,4.8
Another tropical storm could develop in Caribbean Sea after Halloween,11.9
"Meet the American who invented the hard hat, a symbol of our nation's working class",8.0
"On this day in history, Teddy Roosevelt is born in New York City",4.8
Shaq’s comments to Angel Reese about her tiny shorts has internet talking,5.6
Facial recognition glasses turn everyday life into creepy privacy nightmare,11.9
"KITCHEN CABINET:Delicious recipes, surprising power foods & juicy secrets to eating better",12.3
"VACATION MODE:Discover your next getaway, travel hacks & expert recommendations",13.9
"PICTURE OF HEALTH:Doctors on call for you, tips to staying fit & key warning signs",6.4
FUN FACTS:Bees can fly higher than Mount Everest,4.1
Fox Nation,2.9
Features & Faces,2.9
Strength in Numbers: Reno Community Unites In Support of Nevada Women's Volleyball | Alejandro Avila,12.3
Donald Trump Makes Stunning UFO Claim During Joe Rogan Interview: WATCH,6.4
"Skyler Simpson Is A Cowboys Cheerleader For Halloween, Xandra Pohl Enjoys Fall In Miami & The Grills Are Hot",9.1
Transgender Golfer Hailey Davidson Fails To Earn LPGA Card But Does Earn Status On Women's Epson Tour,8.7
Houston residents react to Kamala Harris' visit to Texas alongside Beyoncé days before Election Day,12.7
Nevada voters reveal their prediction for which presidential candidate will win 'very close race',9.9
Ex-Aurora resident and forever Dem forced to flee gang violence says she's voting Republican going forward,13.1
'She hasn't done anything': Nevada voters frustrated with Biden-Harris border policy as election looms,12.3
Philly's firefighters union backs Bob Casey's rival in Senate race,4.8
Harris' polling in NYC is lowest in decades for Democratic nominee: NYT poll,7.2
What is landlord insurance? How coverage could play into a squatter situation,8.0
"On this day in history, October 26, 1825, Erie Canal opens, transforming American infrastructure, commerce",11.5
Young voter turned off by Harris' 'pandering': Seems like abortion is 'only thing I'm allowed to care about',8.0
"Trump on track for 'narrow landslide' victory, Kellyanne Conway predicts",7.2
SEAN HANNITY: Democrats have failed Americans,6.8
Voters at Atlanta barbershop not sold on VP Harris' economic pitch: 'I don't need a handout',8.4
"Ex-Vatican ambassador, Pope Francis critic calls Harris 'infernal monster'",13.9
My father was Sen. Joe Lieberman. His last words are what we need to hear right now,0.7
Dems need to ramp up early voting efforts to match GOP momentum in North Carolina: analyst,9.5
"Presidential election is making most Americans anxious, surveys say: Here are 6 tips to calm down",9.5
New anti-theft features rolling out on Android 15,4.1
Why you should be using a VPN to safeguard your stock trading activities,7.2
VIDEO: Texas machete-wielding man's intrusion into home thwarted by gun owner,7.6
Facial recognition glasses turn everyday life into creepy privacy nightmare,11.9
"Truck ramming attack near Israeli army base leaves 1 dead, dozens injured; suspect killed",6.4
"Fraudsters wheel away huge haul of artisan cheddar worth an eye-popping $400,000",6.8
"Israel’s 'Days of Repentance' strikes against Iran will continue if terror regime responds, IDF warns",8.0
UN secretary-general won’t condemn official accused of antisemitism; US said to grant visa for visit,11.5
Doug Emhoff 'reshaped the perception of masculinity'? Let's consult the Torah,5.4
My father was Sen. Joe Lieberman. His last words are what we need to hear right now,0.7
JONATHAN TURLEY: Why I'm congratulating the Washington Post,10.0
Trump isn’t the first president menaced by Derangement Syndrome,9.2
"Presidential election is making most Americans anxious, surveys say: Here are 6 tips to calm down",9.5
‘Should I go to the ER or urgent care?’: Ask a doctor,0.9
"Dementia risk could be higher for older adults who experience this type of injury, study finds",8.4
"After a breast cancer diagnosis, here are 10 important things you should do, experts say",8.0
Child-abusing mommy blogger Ruby Franke's daughter warns parents about posting kids' pictures online,10.7
Perez Hilton predicts Menendez brothers could see public ‘turn’ on them after prison release,6.4
"Fraudsters wheel away huge haul of artisan cheddar worth an eye-popping $400,000",6.8
Search underway for man accused of killing his pregnant wife while on parole for murder,6.8
"'I'm an author and I'm grateful for democracy, including our First Amendment rights'",7.2
Visiting the Constitution can remind us that America is all about 'We the People',8.8
"Health, happiness and helping others are vital parts of free and responsible society, Founding Fathers taught",11.9
"Meet the American who defined a new national identity, Noah Webster, New England patriot armed with the pen",10.3
"On this day in history, October 27, 1858, Teddy Roosevelt, American titan, is born in New York City",9.1
Ex-Trump officials tell Americans to 'heed General Kelly's warning' Trump's a fascist,10.3
Pentagon denies false claim that Biden-Harris admin authorized troops to use force against Americans,9.9
"On this day in history, October 25, 1944, first kamikaze suicide pilots attack US Navy in World War II",8.3
Luke Combs and Eric Church raise over $24.5 million for hurricane victims at star-studded Concert for Carolina,5.4
Prince William publicly mentions Prince Harry for first time in recent memory while discussing childhood,8.0
"Zach Bryan backlash over breakup is latest controversy after arrest, drunken Taylor Swift comment",9.9
Beatle Paul McCartney helped John Lennon win back Yoko Ono after star cheated with another woman: pal,8.7
Texas A&M's Mike Elko has fiery message after major win: 'It’s not a politician running this program',7.6
Spurs' Gregg Popovich rails against Trump in lengthy rant: 'Danger follows the delusion',3.6
"Patrick Mahomes is already ‘No. 2 in the GOAT conversation,’ ex-NFL star says",4.6
"Michigan, Michigan State players brawl after game: 'Lil’ bro stay doing lil’ bro things'",6.4
"Hurricane Helene: More than 90 reported dead in North Carolina, 10 unaccounted for",10.7
Child-abusing mommy blogger Ruby Franke's daughter warns parents about posting kids' pictures online,10.7
Perez Hilton predicts Menendez brothers could see public ‘turn’ on them after prison release,6.4
Florida deputies arrest dozens of illegal immigrants allegedly caught looting from Hurricane Milton victims,13.5
"'Stay Married Chicken,' indulgent and delicious, has 'definitely worked,' says family-minded creator",15.1
Restaurant visitors instructed on strict behavior by 21 signs: 'Rules are rules',8.0
Matthew McConaughey always planned to ditch Hollywood for Texas,6.8
DC gears up for presidential inauguration as tourism industry braces for surge in visitors,11.1
Why some Americans will receive an extra Social Security check in November,10.3
Mysterious $7B estate tax payment spurs questions about source of funds,6.4
Harvard fundraising slumps after antisemitism controversy,13.9
"Biden administration forgives $4.5 million in student debt for 60,000 borrowers",7.8
When a Facebook friend request turns into a hacker’s trap,4.8
New anti-theft features rolling out on Android 15,4.1
Fox News AI Newsletter: Bureaucrats ordered to use AI,6.8
Why you should be using a VPN to safeguard your stock trading activities,7.2
'Conclave' director says controversial scenes in movie about papal elections 'not a takedown of the church',9.5
Helen Mirren says Kurt Cobain's death is 'so sad' because he 'never saw GPS',5.2
"Nicole Kidman, Cher, Kim Kardashian turn heads in figure-hugging gowns: PHOTOS",7.6
Liam Neeson confesses he’s ‘madly in love’ with co-star Pamela Anderson,6.4
"Costco issues recall notices for frozen waffles, freeze dried meat over listeria concerns",8.4
Palatial California billionaire-owned estate hits market for whopping $108M,12.7
Bill Murray's former New York home in swanky star-studded enclave hits the market for $3.69 million,7.2
Union autoworker predicts blue voting bloc will vote for Trump in 'big numbers': 'He's speaking our language',7.6
"Faith leader wants Christians to 'love their Bibles': It is 'true and trustworthy,' he says",5.6
My father was Sen. Joe Lieberman. His last words are what we need to hear right now,0.7
Bay Area city pays $1.5 million after years-long fight to take down cross,1.1
Fox News ‘Antisemitism Exposed’ Newsletter: Israel-US relations crippled by damaging leak,12.3
3 ways Kamala Harris promotes chaos with her energy message,7.2
"Chicago eliminates migrant-only shelters, 'landing zone'",12.7
"What Michael Jordan is like as a NASCAR boss, according to his star driver",5.2
You won't believe how far Volvo's new electric semitruck goes on a single charge,4.0
The four 'dreaded' letters on airline boarding passes that travelers say they never want to see,8.4
"On this day in history, October 27, 1858, Teddy Roosevelt, American titan, is born in New York City",9.1
What is landlord insurance? How coverage could play into a squatter situation,8.0
American Airlines cracks down against 'gate lice' as airport passengers skip lines amid boarding process,8.0
Luke Combs and Eric Church raise over $24.5 million for hurricane victims at star-studded Concert for Carolina,5.4
"Zach Bryan backlash over breakup is latest controversy after arrest, drunken Taylor Swift comment",9.9
Beatle Paul McCartney helped John Lennon win back Yoko Ono after star cheated with another woman: pal,8.7
Lizzo wears Ozempic-themed Halloween costume inspired by 'South Park' parody after slamming allegations,13.1
"'Stay Married Chicken,' indulgent and delicious, has 'definitely worked,' says family-minded creator",15.1
5 peculiar pizza toppings that are common around the world,6.0
Jimmy John's announces 'Picklewich' — here's how people responded,8.8
Ghost in a restaurant? Man says coffee shop haunted by Civil War soldier,3.5
Another tropical storm could develop in Caribbean Sea after Halloween as hurricane season nears final month,13.1
Northeast wildfire threat shifts to New England on Sunday,4.4
Beloved 'Rainbow Bridge' honoring lost pets in North Carolina washed away by Helene,7.2
Volcanic ash from Mexican volcano spotted over Florida,10.0
"One Nation with Brian Kilmeade - Saturday, October 26",8.8
"Life, Liberty & Levin - Saturday, October 26",10.4
"The Big Weekend Show - Saturday, October 26",7.2
"The Journal Editorial Report - Saturday, October 26",15.5
Search underway for man accused of killing his pregnant wife while on parole for murder,6.8
At least 126 dead and missing in massive flooding and landslides in Philippines,6.0
"A man who abused up to 3,500 girls online has been sentenced for crimes including manslaughter",7.2
More than 40 dogs killed in fire at rescue group’s kennels in New York,2.9
Michelle Obama accuses critics of 'picking apart' Harris' interview answers to distract from Trump's faults,10.3
Trump-Vance ticket has done combined 96 interviews since August compared to 57 for Harris-Walz,8.8
98 days: Kamala Harris has yet to do formal press conference since emerging as Democratic nominee,9.5
'Conclave' director says controversial scenes in movie about papal elections 'not a takedown of the church',9.5
UN secretary-general won’t condemn official accused of antisemitism; US said to grant visa for visit,11.5
Israeli woman bravely describes horror as Hamas hostage: 'They were taking pleasure in hurting me',8.0
"Anti-Israel protesters take over University of Minnesota admin building, 11 arrested",15.8
Jewish-American group urges US citizens in Israel to vote as absentee ballots can impact swing states,9.5
Florida deputies arrest dozens of illegal immigrants allegedly caught looting from Hurricane Milton victims,13.5
Harris' polling in NYC is lowest in decades for Democratic nominee: NYT poll,7.2
VICTOR DAVIS HANSON: 10 alarming signs we are in the middle of a cultural revolution,9.1
Texas Gov. Greg Abbott challenges Kamala Harris to declare Tren de Aragua a terrorist organization,10.3
"Lisa Bevere: Fighting for Women’s Divine Right, Calling Out the Evil of Gender Ideology",8.8
From Washington: The Battle For Control Of The House,4.4
Fox Sports Update – Yankees Kept From Bombing,3.7
Extra: Is The American Dream Dead? Mr. Wonderful Weighs In.,4.1
